"id","title"
"10147f90-ac2f-11e9-8a69-bb4b29648562","Fat Blasting Booty Builder - HIIT Cardio and Strength Training Workout"
"929ace10-ac2f-11e9-8a69-bb4b29648562","Strength and Interval Cardio Blend to Burn Fat - Total Body Sandbag Workout Video"
"85bc95c0-ac2f-11e9-8a69-bb4b29648562","Stress Busting Yoga Pilates Workout - Relaxing Stretch Workout for Flexibility"
"099d1280-ac2f-11e9-8a69-bb4b29648562","Upper Body Alternating Dumbbell Workout - Challenge Upper Body Strength and Coordination"
"a443ca50-ac2e-11e9-8a69-bb4b29648562","At Home HIIT Workout - Intense Calorie Burning HIIT Cardio Workout for Busy People"
"d3d49bf0-ac2e-11e9-8a69-bb4b29648562","Fun and Brutal HIIT & Total Body Strength Workout with Cardio Burnout (Bored Easily)"
"24b5e960-ac30-11e9-8a69-bb4b29648562","Kelli's Cardio Kickboxing Workout"
"14beff60-ac30-11e9-8a69-bb4b29648562","Pyramid HIIT Training - Intense Interval Cardio Challenge"
"7d579410-ac30-11e9-8a69-bb4b29648562","28 Minute Snowboard Workout - Conditioning Workout Routine"
"12205fb0-ac30-11e9-8a69-bb4b29648562","28 Minute Pilates Cardio Workout"
"a8c27f30-ac2f-11e9-8a69-bb4b29648562","HIIT Like a Girl Round 2 - Fat Burning HIIT Cardio Workout"
"456e1240-ac30-11e9-8a69-bb4b29648562","At Home HIIT Workout Program for Fat Loss"
"d7625690-ac2e-11e9-8a69-bb4b29648562","Burnout Butt & Thigh Workout - Strength and HIIT Workout for Lower Body"
"ecb02d00-ac2f-11e9-8a69-bb4b29648562","Fat Burning Low Impact Cardio Workout at Home - Recovery Cardio Training"
"2d8e77f0-ac30-11e9-8a69-bb4b29648562","Brutal 35 Minute Bodyweight Workout"
"a58a3790-ac2f-11e9-8a69-bb4b29648562","450 Rep Home Cardio Workout - Total Body Endurance Cardio Workout to Banish Fat"
"fa359740-ac2e-11e9-8a69-bb4b29648562","Chill Out! Stretching, Pilates, Yoga Workout for Flexibility and Calm"
"1bfaf4f0-ac30-11e9-8a69-bb4b29648562","Bodyweight Cardio Training + Lower Body Strength - 37 Minute Butt & Thigh Workout"
"9ced0450-ac2f-11e9-8a69-bb4b29648562","1000 Calorie Workout - HIIT Cardio, Strength, Kickboxing and Abs Workout to Burn 1000 Calories"
"c80bf250-ac2e-11e9-8a69-bb4b29648562","Mass Building Lower Body Workout"
"9b5bb5f0-ac2f-11e9-8a69-bb4b29648562","Upper Body Kettlebell Training for Strength - 30 Minute Kettlebell Workout Video"
"00dc9fd0-ac2f-11e9-8a69-bb4b29648562","Brutal Butt and Thigh Workout - Lower Body Strength Training Sweatfest"
"29d4c0c0-ac2f-11e9-8a69-bb4b29648562","Brutal Fat Burning Cardio HIIT + Dynamic Total Body Strength Training - FB Blend"
"5ff171d0-ac2f-11e9-8a69-bb4b29648562","1000 Calorie Workout Video: 94 Minute Insane Bodyweight Workout Challenge - Attempt at Your Own Risk"
"2249c0d0-ac2f-11e9-8a69-bb4b29648562","Quick 10 Minute Core Workout - Pain in My Abs"
"4f59b3f0-ac2f-11e9-8a69-bb4b29648562","100 Rep Lunge Challenge - Thigh Toning, Butt Lifting Lunge Workout"
"226b3610-ac30-11e9-8a69-bb4b29648562","Pilates Workout for Lean Legs & Toned Core"
"d8b56e00-ac2f-11e9-8a69-bb4b29648562","10 Min Abs Workout - At Home Abdominal and Oblique Exercises"
"d57907b0-ac2f-11e9-8a69-bb4b29648562","Thigh Slimming Pilates Butt and Thigh Workout - Free 32 Minute Online Pilates Class"
"dd731290-ac2e-11e9-8a69-bb4b29648562","Fun Upper Body Workout for Great Arms & Shoulders (Bored Easily)"
"e1ad9280-ac2f-11e9-8a69-bb4b29648562","When I Say Jump HIIT Cardio Workout Round 2 - 28 Min High Intensity Interval Training"
"5bc2bc40-ac2f-11e9-8a69-bb4b29648562","Insane HIIT Challenge - Bodyweight Only High Intensity Interval Training Workout"
"2429aef0-ac30-11e9-8a69-bb4b29648562","Mixed Martial Arts HIIT - Train Like a MMA Fighter"
"5457f910-ac30-11e9-8a69-bb4b29648562","Low Impact Cardio Workout for Beginners"
"0a2e7d10-ac2f-11e9-8a69-bb4b29648562","At Home Cardio Workout to Burn Fat and Tone (High & Low Impact Modifications)"
"f8cc9160-ac2e-11e9-8a69-bb4b29648562","Fitness Blender's Free 5-Day Workout Challenge: Strong and Lean, Day 2"
"7d163ac0-ac2f-11e9-8a69-bb4b29648562","Total Body Warm Up Cardio - 5 Minute Warm Up Workout"
"33a89f40-ac2f-11e9-8a69-bb4b29648562","Abs and Obliques Workout - The 4 Best Abs and Obliques Exercises"
"e4f0a500-ac2e-11e9-8a69-bb4b29648562","Fitness Blender's Free 3-Day Flexibility Challenge: Day 3 (Static Stretches for Flexibility and Range of Motion)"
"e3cee150-ac2e-11e9-8a69-bb4b29648562","Ultimate HIIT Workout for People Who Get Bored Easily - Fat Burning HIIT Cardio Workout"
"d9319850-ac2e-11e9-8a69-bb4b29648562","Total Body Strength Workout for People who get Bored Easily - Total Body Burnout"
"b6492c80-ac2f-11e9-8a69-bb4b29648562","At Home Bodyweight Cardio Interval Workout - Sweat Like You Mean It"
"587b8b10-ac30-11e9-8a69-bb4b29648562","HIIT Workout for Endurance - Brutal 30 Minute Home Cardio & Toning"
"82c99480-ac2f-11e9-8a69-bb4b29648562","Brutal Anaerobic Threshold HIIT - Fat Burning HIIT Cardio"
"41a179e0-ac30-11e9-8a69-bb4b29648562","Toning and Weight Loss Boot Camp"
"3cec24a0-ac2f-11e9-8a69-bb4b29648562","Fun 10 Minute Abs and Obliques Workout - Quick 10 Minute Abs Workout for A Toned Stomach"
"1b263540-ac2f-11e9-8a69-bb4b29648562","Lower Body Strength and Plyometrics - Mass and Power Workout Video for Legs"
"6916c0d0-ac2f-11e9-8a69-bb4b29648562","5 Minute Butt and Thigh Workout for a Bigger Butt - Exercises to Lift and Tone Your Butt and Thighs"
"4d026100-ac30-11e9-8a69-bb4b29648562","10 Minute At Home Butt and Thigh Workout Video"
"fc41c580-ac2f-11e9-8a69-bb4b29648562","Best Workouts to Lose Belly Fat Quickly - Cardio, Abs and Obliques Workout"
"c455f9c0-ac2f-11e9-8a69-bb4b29648562","Quick and Intense Bodyweight HIIT Cardio Workout - Blenders HIIT Harder!"
"f95c0020-ac2e-11e9-8a69-bb4b29648562","Fitness Blender's Free 5-Day Workout Challenge: Strong and Lean, Day 1"
"f6e64530-ac2e-11e9-8a69-bb4b29648562","Fitness Blender's Free 5-Day Workout Challenge: Strong and Lean, Day 5"
"8cfc0dc0-ac2f-11e9-8a69-bb4b29648562","Butt and Thigh Workout - Cardio, Plyo, Pilates and Strength Training Workout for Lower Body"
"cff39130-ac2e-11e9-8a69-bb4b29648562","Build a Booty Workout - Strength and Pilates Workout for Butt and Thighs"
"b94aa220-ac2e-11e9-8a69-bb4b29648562","Shoulders, Back, Chest and Arm Workout for Strong Toned Upper Body"
"4574e580-ac2f-11e9-8a69-bb4b29648562","Cardio HIIT Workout + Butt, Thighs, Abs: Ultimate Workout for Belly Fat Loss, No Equipment"
"34477750-ac2f-11e9-8a69-bb4b29648562","Low Impact HIIT Cardio Workout - The 4 Best Low Impact Cardio Exercises for Fat Loss and Toning"
"d1d999d0-ac2f-11e9-8a69-bb4b29648562","Brutal Kettlebell HIIT Cardio Tabata Workout - Get Your HIIT Together"
"c9929250-ac2e-11e9-8a69-bb4b29648562","At Home Butt and Thigh Workout with No Equipment"
"d0a9a550-ac2f-11e9-8a69-bb4b29648562","Quick At Home Abs and Obliques Workout Video"
"a3805340-ac2e-11e9-8a69-bb4b29648562","Complete Upper Body Workout for Strength & Toning: Arms, Shoulders, Chest, and Back Workout"
"eba859f0-ac2f-11e9-8a69-bb4b29648562","Red Light Green Light Workout - Glutes, Abs, and Cardio Workout"
"73960510-ac30-11e9-8a69-bb4b29648562","Calorie Blasting Cardio Boot Camp Workout"
"47daa570-ac30-11e9-8a69-bb4b29648562","Lean Mean Legs - Butt & Thigh Workout"
"b0986ad0-ac2f-11e9-8a69-bb4b29648562","Spartan 500 Workout Round 2 - 500 Repetition Workout Challenge"
"15129310-ac2f-11e9-8a69-bb4b29648562","Stress Busting Cardio KickBoxing and Core Workout"
"5019f6b0-ac2f-11e9-8a69-bb4b29648562","Tank Top Arms Workout - Best Upper Body Workout for Toned Arms, Shoulders & Upper Back"
"29728710-ac30-11e9-8a69-bb4b29648562","Cardio Infused Standing Abs"
"2c1031d0-ac2f-11e9-8a69-bb4b29648562","Fitness Blender's Free 5-Day Workout Challenge: For Busy People, Day 5"
"f3843900-ac2f-11e9-8a69-bb4b29648562","100 Repetition Abs and Obliques Workout - 5 Minute Abs Workout"
"e119ac60-ac2e-11e9-8a69-bb4b29648562","Fat Burning Cardio and Butt and Thigh Workout - Advanced & Low Impact Modifications"
"f1336b30-ac2f-11e9-8a69-bb4b29648562","Quick Lower Body Workout For Strength - Dumbbell Leg Workout"
"2e1d7180-ac30-11e9-8a69-bb4b29648562","Cardio Kickboxing and Core Workout"
"4a983440-ac2f-11e9-8a69-bb4b29648562","Quick Abs and Obliques Workout Video - At Home Abs Workout"
"80da95c0-ac2f-11e9-8a69-bb4b29648562","Upper Body Superset Workout with Fat Burning Cardio Intervals - Arm, Chest, Back & Shoulder Workout"
"7e06b540-ac2f-11e9-8a69-bb4b29648562","Lower Body Active Stretching Routine - Low Impact Workout to Tone and Stretch"
"fbaf2270-ac2f-11e9-8a69-bb4b29648562","Total Body Strength and Cardio Blend"
"d79705b0-ac2f-11e9-8a69-bb4b29648562","Pilates Abs and Obliques, Workout - 26 Minute Fitness Blender Online Pilates Class"
"f32c4a70-ac2e-11e9-8a69-bb4b29648562","Cardio Warm Up for Lower Body Strength Workouts"
"ab8d7b80-ac2e-11e9-8a69-bb4b29648562","No Equipment HIIT Cardio Home Workout - Quick and Intense HIIT"
"fd53aab0-ac2f-11e9-8a69-bb4b29648562","No Squat Leg Workout - Squat Free Butt & Thigh Workout"
"c18df590-ac2e-11e9-8a69-bb4b29648562","Functional Upper Body Workout for Strength and Coordination"
"7c5f9f80-ac30-11e9-8a69-bb4b29648562","28 Minute Total Body Slosh Pipe Workout - Slosh Tube Exercises for Strength & Toning"
"435dcfe0-ac30-11e9-8a69-bb4b29648562","Cool Down and Full Body Stretch"
"166d72b0-ac30-11e9-8a69-bb4b29648562","5 Minutes to a Bigger, Rounder Butt - Glute and Thigh Workout for a Bigger Butt"
"7600ea90-ac30-11e9-8a69-bb4b29648562","Best Calf Workout Routine - Calf Exercises to Tone and Shape"
"57d4b930-ac2f-11e9-8a69-bb4b29648562","Quick Sweat Cardio Burst - Fast Fat Burning Cardio Workout with Kelli & Daniel"
"b1b9e060-ac2f-11e9-8a69-bb4b29648562","Goodbye Stress Calming Stretching Workout - Full Body Yoga Infused Stretching Routine"
"d146f6c0-ac2f-11e9-8a69-bb4b29648562","Butt and Thigh Workout for a Bigger Butt - Workout for a Round Butt and Toned Legs"
"5f581800-ac2f-11e9-8a69-bb4b29648562","Butt and Thigh Workout - Glutes, Calves, Outer and Inner Thigh Workout"
"b6dc1320-ac2e-11e9-8a69-bb4b29648562","Upper Body Workout Cardio Kickboxing - Strength and Cardio Workout"
"7192fe90-ac2f-11e9-8a69-bb4b29648562","Total Body Strength Training and Core Workout for Beginners - Low Impact Workout at Home"
"559d66d0-ac2f-11e9-8a69-bb4b29648562","Fun Kickboxing and HIIT Cardio Workout Challenge - HIIT Fat Burner with Warm Up & Cool Down"
"42d07970-ac2f-11e9-8a69-bb4b29648562","15 Minute Total Body HIIT Workout - Advanced Bodyweight Exercises to Burn Fat Fast"
"2af24940-ac30-11e9-8a69-bb4b29648562","Tank Top Arms Workout - Arms, Chest, Back and Shoulders"
"81ef6bb0-ac30-11e9-8a69-bb4b29648562","15 Minute Total Body Boot Camp"
"c3f44730-ac2e-11e9-8a69-bb4b29648562","Fat Burning HIIT Cardio Workout"
"b03c5d90-ac2e-11e9-8a69-bb4b29648562","Upper Body and Abs Workout - Compound Upper Body Workout for Strength and Coordination"
"05c03100-ac30-11e9-8a69-bb4b29648562","Beginner Pilates Workout Video - Great Post Pregnancy Workout for New Mothers"
"f6205d20-ac2e-11e9-8a69-bb4b29648562","1000 Calorie Workout Video - At Home HIIT Cardio, Strength, and Abs Workout to Burn 1000 Calories"
"31f8afe0-ac30-11e9-8a69-bb4b29648562","Interval Training Workout - Toning and Cardio Boot Camp"
"2fed9310-ac2f-11e9-8a69-bb4b29648562","Cardio and Abs Workout - Fat Burning Core and Cardio Intervals"
"c4cb9460-ac2e-11e9-8a69-bb4b29648562","20 Minute Pilates Workout: Pilates Butt and Thigh Workout"
"f8bdcee0-ac2f-11e9-8a69-bb4b29648562","Comprehensive Total Body HIIT Cardio and Core Workout"
"5d0a13e0-ac30-11e9-8a69-bb4b29648562","Upper Body Functional Strength Training Workout with Dumbbells"
"cd32ea90-ac2e-11e9-8a69-bb4b29648562","At Home Upper Body Strength Workout for Arms, Shoulders, Chest & Back"
"550b38f0-ac2f-11e9-8a69-bb4b29648562","Restorative Yoga Pilates Workout to Improve Mood & Circulation - Relaxing Stretching Workout"
"16f392a0-ac30-11e9-8a69-bb4b29648562","Little Black Dress Boot Camp Workout - Total Body Sculpting Routine"
"83b9e7f0-ac2f-11e9-8a69-bb4b29648562","No Equipment Upper Body Workout for Great Arms, Shoulders and Upper Back"
"9beb24b0-ac2f-11e9-8a69-bb4b29648562","Butt and Abs Tabata Workout - Fat Blasting Cardio Interval Workout"
"9728e1b0-ac2f-11e9-8a69-bb4b29648562","Low Impact Workout for Beginners - 40 Minute Total Body Beginner Workout"
"cb5ca3f0-ac2e-11e9-8a69-bb4b29648562","No Equipment Butt and Thigh Workout + Fat Burning Cardio Intervals"
"e4a26880-ac2f-11e9-8a69-bb4b29648562","At Home Hamstring Workout Video - Hamstring Exercises with No Equipment"
"c3c1a900-ac2f-11e9-8a69-bb4b29648562","At Home Upper Body Workout - Comprehensive Superset Upper Body Workout"
"f12270b0-ac2e-11e9-8a69-bb4b29648562","Abs and Lower Body Pilates Workout for Beginners"
"dcc87ab0-ac2e-11e9-8a69-bb4b29648562","Strength and HIIT Workout - Intense Lower Body Workout"
"0e3167b0-ac2f-11e9-8a69-bb4b29648562","1000 Calorie Workout for 2 Million Subscribers! At Home Workout to Burn 1000 Calories"
"e8ec8ac0-ac2e-11e9-8a69-bb4b29648562","Upper Body Workout for Great Shoulders - Arms, Back, Chest, and Shoulder Workout"
"7ee8b0d0-ac2f-11e9-8a69-bb4b29648562","10 Minute Abs Workout - At Home Abs and Obliques Exercises with No Equipment"
"7bc70900-ac30-11e9-8a69-bb4b29648562","30 Minute At Home Abs and Cardio Workout Video"
"4e4de940-ac2f-11e9-8a69-bb4b29648562","Low Impact Cardio Workout: No-Jump Belly Fat Burner Interval Workout"
"c77a60b0-ac2e-11e9-8a69-bb4b29648562","Fat Burning HIIT Cardio Workout with No Equipment"
"72ff6a60-ac30-11e9-8a69-bb4b29648562","Challenging Exercise Ball Ab Workout"
"6c6bb830-ac2f-11e9-8a69-bb4b29648562","Non-Stop Endurance Kettlebell Workout - 33 Minute Total Body Kettlebell Routine"
"31fc00b0-ac2f-11e9-8a69-bb4b29648562","Fitness Blender's Free 5-Day Workout Challenge: For Busy People, Day 1"
"eb48ca40-ac2e-11e9-8a69-bb4b29648562","Relaxing Total Body Stretching Workout for Stress Relief and Better Sleep - Before Bed Stretches"
"2c0084f0-ac30-11e9-8a69-bb4b29648562","Quick HIIT - Cardio Workout to Boost Metabolism"
"2d433390-ac2f-11e9-8a69-bb4b29648562","Fitness Blender's Free 5-Day Workout Challenge: For Busy People, Day 4"
"267face0-ac30-11e9-8a69-bb4b29648562","Plyometric and Cardio HIIT for Legs - Functional Plyometrics for Endurance"